{"contract_version":"1.0","decided_at":"2026-08-06T00:05:00Z","decision":"DEFER","evidence_refs":["review-evidence-defer-issue-005"],"proposal_id":"urn:kg-mnp:modeling-proposal:61f50f9acfb6cd4618fb00b43a459ac45cb527b3264c69fbb6d3196727d17079","proposal_semantic_hash":"61f50f9acfb6cd4618fb00b43a459ac45cb527b3264c69fbb6d3196727d17079","rationale":"Issue retained for a later modeling review session.","reviewer_id":"urn:kg-mnp:reviewer:professor-001","target":{"issue_id":"urn:kg-mnp:issue:d2fed45041bf12be087a0afb6f91fdc3f25c7410d1dbdd6c87b2ac69f3beeb68"}}
