{"contract_version":"1.0","decided_at":"2026-08-06T00:02:00Z","decision":"MODIFY_AND_CONFIRM","evidence_refs":["review-evidence-modified-001"],"modified_candidate":{"business_fact_evidence_refs":["source-basic"],"candidate_id":"urn:kg-mnp:candidate:e796e2a2f060c5549f4ba10b1a698e1347c40193d05a0c57823e7b7e3b3b6854","class_iri":"https://yangjunjie-lin.github.io/KG-MNP-Demo/ontology/terms#Subscriber","confidence":{"basis":"RULE_AND_SOURCE","components":[{"basis":"RULE_DECLARED","component":"MAPPING_RULE","level":"MEDIUM","score":0.7},{"basis":"SOURCE_DECLARED","component":"SOURCE_METADATA","level":"HIGH","score":0.95}],"level":"MEDIUM","score":0.7},"mapping_rule_ids":["subscriber-entity-from-id"],"modeling_evidence_refs":["docs/ontology/term-inventory.csv#Subscriber","domain_packs/mnp/mappings/tmf_to_mnp.yaml#TMF629-Customer-to-Subscriber"],"proposed_iri":"https://yangjunjie-lin.github.io/KG-MNP-Demo/data/modeled/3c57cca129580c393bb6994fbf088209879907efde712279eb6de9986ba6d457","publication_scope":"ABOX","rationale":"Human-reviewed Subscriber entity with clarified rationale after source audit.","review_status":"PROPOSED","source_paths":["/subscriber/id"]},"proposal_id":"urn:kg-mnp:modeling-proposal:af663b63b92a65e88b8584a667a04c64798dc53eeb5b288ac51dc59c5fb34ff4","proposal_semantic_hash":"af663b63b92a65e88b8584a667a04c64798dc53eeb5b288ac51dc59c5fb34ff4","rationale":"Adjust subscriber rationale after human audit of source evidence.","reviewer_id":"urn:kg-mnp:reviewer:professor-001","target":{"candidate_id":"urn:kg-mnp:candidate:d34f2db397b76e7e026a66d34d3953cf3891b2b1fe99135ce4b68810511cece8"}}
