{"contract_version":"1.0","decided_at":"2026-08-06T00:01:00Z","decision":"CONFIRM","evidence_refs":["review-evidence-reject-001"],"proposal_id":"urn:kg-mnp:modeling-proposal:af663b63b92a65e88b8584a667a04c64798dc53eeb5b288ac51dc59c5fb34ff4","proposal_semantic_hash":"af663b63b92a65e88b8584a667a04c64798dc53eeb5b288ac51dc59c5fb34ff4","rationale":"Confirm in-scope candidate #1.","reviewer_id":"urn:kg-mnp:reviewer:professor-001","target":{"candidate_id":"urn:kg-mnp:candidate:3dc3320b259383e00326e8f8bf0397725990373ef0c7244b1ad154cb64e131a7"}}
