{"contract_version":"1.0","decided_at":"2026-08-06T00:02:00Z","decision":"CONFIRM","evidence_refs":["review-evidence-defer-002"],"proposal_id":"urn:kg-mnp:modeling-proposal:61f50f9acfb6cd4618fb00b43a459ac45cb527b3264c69fbb6d3196727d17079","proposal_semantic_hash":"61f50f9acfb6cd4618fb00b43a459ac45cb527b3264c69fbb6d3196727d17079","rationale":"Confirm entity while conflict remains deferred #2.","reviewer_id":"urn:kg-mnp:reviewer:professor-001","target":{"candidate_id":"urn:kg-mnp:candidate:99960356bfdf3328061ead5c68b30c23da50aa6079072bfe3c2fab84004f7c11"}}
