{"contract_version":"1.0","decided_at":"2026-08-06T00:02:00Z","decision":"REJECT","evidence_refs":["review-evidence-reject-001"],"proposal_id":"urn:kg-mnp:modeling-proposal:af663b63b92a65e88b8584a667a04c64798dc53eeb5b288ac51dc59c5fb34ff4","proposal_semantic_hash":"af663b63b92a65e88b8584a667a04c64798dc53eeb5b288ac51dc59c5fb34ff4","rationale":"Subscriber candidate is out of scope for this dataset modeling run.","reviewer_id":"urn:kg-mnp:reviewer:professor-001","target":{"candidate_id":"urn:kg-mnp:candidate:d34f2db397b76e7e026a66d34d3953cf3891b2b1fe99135ce4b68810511cece8"}}
