{"contract_version":"1.0","decided_at":"2026-08-06T00:03:00Z","decision":"REJECT","evidence_refs":["review-evidence-resolve-blocking-001"],"proposal_id":"urn:kg-mnp:modeling-proposal:61f50f9acfb6cd4618fb00b43a459ac45cb527b3264c69fbb6d3196727d17079","proposal_semantic_hash":"61f50f9acfb6cd4618fb00b43a459ac45cb527b3264c69fbb6d3196727d17079","rationale":"Blocking conflict is not modeling-relevant after human evidence review; no status assertion is confirmed in this package.","reviewer_id":"urn:kg-mnp:reviewer:professor-001","target":{"issue_id":"urn:kg-mnp:issue:d1d6f84520bc7221eead2f77dc44f999fd62c62828f3b99c17a89c27753e539d"}}
